deckID,number,name,location,color,cmc,manaCost,power,toughness,text,types,subtypes,key,colors,baseColors,splashes,sphere,archetype,powered
282,1,Misty Rainforest,MB,Colorless,0,NA,NA,NA,"{T}, Pay 1 life, Sacrifice Misty Rainforest: Search your library for a Forest or Island card, put it onto the battlefield, then shuffle your library.",Land,NA,VMLBTENJGFPSRIRDJWBSZGKPCC, red green blue, red green, blue,midrange combo,twin,FALSE
282,1,Lumbering Falls,MB,Colorless,0,NA,NA,NA,"Lumbering Falls enters the battlefield tapped.
{T}: Add {G} or {U}.
{2}{G}{U}: Lumbering Falls becomes a 3/3 green and blue Elemental creature with hexproof until end of turn. It's still a land.",Land,NA,VMLBTENJGFPSRIRDJWBSZGKPCC, red green blue, red green, blue,midrange combo,twin,FALSE
282,1,Bloodstained Mire,MB,Colorless,0,NA,NA,NA,"{T}, Pay 1 life, Sacrifice Bloodstained Mire: Search your library for a Swamp or Mountain card, put it onto the battlefield, then shuffle your library.",Land,NA,VMLBTENJGFPSRIRDJWBSZGKPCC, red green blue, red green, blue,midrange combo,twin,FALSE
282,1,Tropical Island,MB,Colorless,0,NA,NA,NA,({T}: Add {G} or {U}.),Land,Forest Island,VMLBTENJGFPSRIRDJWBSZGKPCC, red green blue, red green, blue,midrange combo,twin,FALSE
282,1,Elvish Mystic,MB,Green,1,{G},1,1,{T}: Add {G}.,Creature,Elf Druid,VMLBTENJGFPSRIRDJWBSZGKPCC, red green blue, red green, blue,midrange combo,twin,FALSE
282,1,Noble Hierarch,MB,Green,1,{G},0,1,"Exalted (Whenever a creature you control attacks alone, that creature gets +1/+1 until end of turn.)
{T}: Add {G}, {W}, or {U}.",Creature,Human Druid,VMLBTENJGFPSRIRDJWBSZGKPCC, red green blue, red green, blue,midrange combo,twin,FALSE
282,1,Joraga Treespeaker,MB,Green,1,{G},1,1,"Level up {1}{G} ({1}{G}: Put a level counter on this. Level up only as a sorcery.)
LEVEL 1-4
1/2
{T}: Add {G}{G}.
LEVEL 5+
1/4
Elves you control have ""{T}: Add {G}{G}.""",Creature,Elf Druid,VMLBTENJGFPSRIRDJWBSZGKPCC, red green blue, red green, blue,midrange combo,twin,FALSE
282,1,Green Sun's Zenith,MB,Green,1,{X}{G},NA,NA,"Search your library for a green creature card with converted mana cost X or less, put it onto the battlefield, then shuffle your library. Shuffle Green Sun's Zenith into its owner's library.",Sorcery,NA,VMLBTENJGFPSRIRDJWBSZGKPCC, red green blue, red green, blue,midrange combo,twin,FALSE
282,1,Fauna Shaman,MB,Green,2,{1}{G},2,2,"{G}, {T}, Discard a creature card: Search your library for a creature card, reveal it, and put it into your hand. Then shuffle your library.",Creature,Elf Shaman,VMLBTENJGFPSRIRDJWBSZGKPCC, red green blue, red green, blue,midrange combo,twin,FALSE
282,1,Phantasmal Image,MB,Blue,2,{1}{U},0,0,"You may have Phantasmal Image enter the battlefield as a copy of any creature on the battlefield, except it's an Illusion in addition to its other types and it has ""When this creature becomes the target of a spell or ability, sacrifice it.""",Creature,Illusion,VMLBTENJGFPSRIRDJWBSZGKPCC, red green blue, red green, blue,midrange combo,twin,FALSE
282,1,Sakura-Tribe Elder,MB,Green,2,{1}{G},1,1,"Sacrifice Sakura-Tribe Elder: Search your library for a basic land card, put that card onto the battlefield tapped, then shuffle your library.",Creature,Snake Shaman,VMLBTENJGFPSRIRDJWBSZGKPCC, red green blue, red green, blue,midrange combo,twin,FALSE
282,1,"Rofellos, Llanowar Emissary",MB,Green,2,{G}{G},2,1,{T}: Add {G} for each Forest you control.,Creature,Elf Druid,VMLBTENJGFPSRIRDJWBSZGKPCC, red green blue, red green, blue,midrange combo,twin,FALSE
282,1,Imperial Recruiter,MB,Red,3,{2}{R},1,1,"When Imperial Recruiter enters the battlefield, search your library for a creature card with power 2 or less, reveal it, put it into your hand, then shuffle your library.",Creature,Human Advisor,VMLBTENJGFPSRIRDJWBSZGKPCC, red green blue, red green, blue,midrange combo,twin,FALSE
282,1,Reclamation Sage,MB,Green,3,{2}{G},2,1,"When Reclamation Sage enters the battlefield, you may destroy target artifact or enchantment.",Creature,Elf Shaman,VMLBTENJGFPSRIRDJWBSZGKPCC, red green blue, red green, blue,midrange combo,twin,FALSE
282,1,Deceiver Exarch,MB,Blue,3,{2}{U},1,4,"Flash (You may cast this spell any time you could cast an instant.)
When Deceiver Exarch enters the battlefield, choose one —
• Untap target permanent you control.
• Tap target permanent an opponent controls.",Creature,Cleric,VMLBTENJGFPSRIRDJWBSZGKPCC, red green blue, red green, blue,midrange combo,twin,FALSE
282,1,Jace Beleren,MB,Blue,3,{1}{U}{U},NA,NA,"+2: Each player draws a card.
−1: Target player draws a card.
−10: Target player puts the top twenty cards of their library into their graveyard.",Planeswalker,Jace,VMLBTENJGFPSRIRDJWBSZGKPCC, red green blue, red green, blue,midrange combo,twin,FALSE
282,1,Wickerbough Elder,MB,Green,4,{3}{G},4,4,"Wickerbough Elder enters the battlefield with a -1/-1 counter on it.
{G}, Remove a -1/-1 counter from Wickerbough Elder: Destroy target artifact or enchantment.",Creature,Treefolk Shaman,VMLBTENJGFPSRIRDJWBSZGKPCC, red green blue, red green, blue,midrange combo,twin,FALSE
282,1,Bloodbraid Elf,MB,Red Green,4,{2}{R}{G},3,2,"Haste
Cascade (When you cast this spell, exile cards from the top of your library until you exile a nonland card that costs less. You may cast it without paying its mana cost. Put the exiled cards on the bottom of your library in a random order.)",Creature,Elf Berserker,VMLBTENJGFPSRIRDJWBSZGKPCC, red green blue, red green, blue,midrange combo,twin,FALSE
282,1,Splinter Twin,MB,Red,4,{2}{R}{R},NA,NA,"Enchant creature
Enchanted creature has ""{T}: Create a token that's a copy of this creature, except it has haste. Exile that token at the beginning of the next end step.""",Enchantment,Aura,VMLBTENJGFPSRIRDJWBSZGKPCC, red green blue, red green, blue,midrange combo,twin,FALSE
282,1,Zealous Conscripts,MB,Red,5,{4}{R},3,3,"Haste
When Zealous Conscripts enters the battlefield, gain control of target permanent until end of turn. Untap that permanent. It gains haste until end of turn.",Creature,Human Warrior,VMLBTENJGFPSRIRDJWBSZGKPCC, red green blue, red green, blue,midrange combo,twin,FALSE
282,1,Gilded Lotus,MB,Colorless,5,{5},NA,NA,{T}: Add three mana of any one color.,Artifact,NA,VMLBTENJGFPSRIRDJWBSZGKPCC, red green blue, red green, blue,midrange combo,twin,FALSE
282,1,"Kiki-Jiki, Mirror Breaker",MB,Red,5,{2}{R}{R}{R},2,2,"Haste
{T}: Create a token that's a copy of target nonlegendary creature you control, except it has haste. Sacrifice it at the beginning of the next end step.",Creature,Goblin Shaman,VMLBTENJGFPSRIRDJWBSZGKPCC, red green blue, red green, blue,midrange combo,twin,FALSE
282,1,Primeval Titan,MB,Green,6,{4}{G}{G},6,6,"Trample
Whenever Primeval Titan enters the battlefield or attacks, you may search your library for up to two land cards, put them onto the battlefield tapped, then shuffle your library.",Creature,Giant,VMLBTENJGFPSRIRDJWBSZGKPCC, red green blue, red green, blue,midrange combo,twin,FALSE
282,1,Consecrated Sphinx,MB,Blue,6,{4}{U}{U},4,6,"Flying
Whenever an opponent draws a card, you may draw two cards.",Creature,Sphinx,VMLBTENJGFPSRIRDJWBSZGKPCC, red green blue, red green, blue,midrange combo,twin,FALSE
282,1,Craterhoof Behemoth,MB,Green,8,{5}{G}{G}{G},5,5,"Haste
When Craterhoof Behemoth enters the battlefield, creatures you control gain trample and get +X/+X until end of turn, where X is the number of creatures you control.",Creature,Beast,VMLBTENJGFPSRIRDJWBSZGKPCC, red green blue, red green, blue,midrange combo,twin,FALSE
283,1,Black Lotus,MB,Colorless,0,{0},NA,NA,"{T}, Sacrifice Black Lotus: Add three mana of any one color.",Artifact,NA,BBMMSAFLDMOPMRSCSCPTSUE, green blue, green blue,,control combo,cheat,TRUE
283,1,Breeding Pool,MB,Colorless,0,NA,NA,NA,"({T}: Add {G} or {U}.)
As Breeding Pool enters the battlefield, you may pay 2 life. If you don't, Breeding Pool enters the battlefield tapped.",Land,Forest Island,BBMMSAFLDMOPMRSCSCPTSUE, green blue, green blue,,control combo,cheat,TRUE
283,1,Mana Confluence,MB,Colorless,0,NA,NA,NA,"{T}, Pay 1 life: Add one mana of any color.",Land,NA,BBMMSAFLDMOPMRSCSCPTSUE, green blue, green blue,,control combo,cheat,TRUE
283,1,Maze of Ith,MB,Colorless,0,NA,NA,NA,{T}: Untap target attacking creature. Prevent all combat damage that would be dealt to and dealt by that creature this turn.,Land,NA,BBMMSAFLDMOPMRSCSCPTSUE, green blue, green blue,,control combo,cheat,TRUE
283,1,Scalding Tarn,MB,Colorless,0,NA,NA,NA,"{T}, Pay 1 life, Sacrifice Scalding Tarn: Search your library for an Island or Mountain card, put it onto the battlefield, then shuffle your library.",Land,NA,BBMMSAFLDMOPMRSCSCPTSUE, green blue, green blue,,control combo,cheat,TRUE
283,1,Arbor Elf,MB,Green,1,{G},1,1,{T}: Untap target Forest.,Creature,Elf Druid,BBMMSAFLDMOPMRSCSCPTSUE, green blue, green blue,,control combo,cheat,TRUE
283,1,Force Spike,MB,Blue,1,{U},NA,NA,Counter target spell unless its controller pays {1}.,Instant,NA,BBMMSAFLDMOPMRSCSCPTSUE, green blue, green blue,,control combo,cheat,TRUE
283,1,Llanowar Elves,MB,Green,1,{G},1,1,{T}: Add {G}.,Creature,Elf Druid,BBMMSAFLDMOPMRSCSCPTSUE, green blue, green blue,,control combo,cheat,TRUE
283,1,Dissenter's Deliverance,MB,Green,2,{1}{G},NA,NA,"Destroy target artifact.
Cycling {G} ({G}, Discard this card: Draw a card.)",Instant,NA,BBMMSAFLDMOPMRSCSCPTSUE, green blue, green blue,,control combo,cheat,TRUE
283,1,Mana Drain,MB,Blue,2,{U}{U},NA,NA,"Counter target spell. At the beginning of your next main phase, add an amount of {C} equal to that spell's converted mana cost.",Instant,NA,BBMMSAFLDMOPMRSCSCPTSUE, green blue, green blue,,control combo,cheat,TRUE
283,1,Oath of Druids,MB,Green,2,{1}{G},NA,NA,"At the beginning of each player's upkeep, that player chooses target player who controls more creatures than they do and is their opponent. The first player may reveal cards from the top of their library until they reveal a creature card. If the first player does, that player puts that card onto the battlefield and all other cards revealed this way into their graveyard.",Enchantment,NA,BBMMSAFLDMOPMRSCSCPTSUE, green blue, green blue,,control combo,cheat,TRUE
283,1,Phantasmal Image,MB,Blue,2,{1}{U},0,0,"You may have Phantasmal Image enter the battlefield as a copy of any creature on the battlefield, except it's an Illusion in addition to its other types and it has ""When this creature becomes the target of a spell or ability, sacrifice it.""",Creature,Illusion,BBMMSAFLDMOPMRSCSCPTSUE, green blue, green blue,,control combo,cheat,TRUE
283,1,Managorger Hydra,MB,Green,3,{2}{G},1,1,"Trample
Whenever a player casts a spell, put a +1/+1 counter on Managorger Hydra.",Creature,Hydra,BBMMSAFLDMOPMRSCSCPTSUE, green blue, green blue,,control combo,cheat,TRUE
283,1,Reclamation Sage,MB,Green,3,{2}{G},2,1,"When Reclamation Sage enters the battlefield, you may destroy target artifact or enchantment.",Creature,Elf Shaman,BBMMSAFLDMOPMRSCSCPTSUE, green blue, green blue,,control combo,cheat,TRUE
283,1,Show and Tell,MB,Blue,3,{2}{U},NA,NA,"Each player may put an artifact, creature, enchantment, or land card from their hand onto the battlefield.",Sorcery,NA,BBMMSAFLDMOPMRSCSCPTSUE, green blue, green blue,,control combo,cheat,TRUE
283,1,Control Magic,MB,Blue,4,{2}{U}{U},NA,NA,"Enchant creature
You control enchanted creature.",Enchantment,Aura,BBMMSAFLDMOPMRSCSCPTSUE, green blue, green blue,,control combo,cheat,TRUE
283,1,Sower of Temptation,MB,Blue,4,{2}{U}{U},2,2,"Flying
When Sower of Temptation enters the battlefield, gain control of target creature for as long as Sower of Temptation remains on the battlefield.",Creature,Faerie Wizard,BBMMSAFLDMOPMRSCSCPTSUE, green blue, green blue,,control combo,cheat,TRUE
283,1,Consecrated Sphinx,MB,Blue,6,{4}{U}{U},4,6,"Flying
Whenever an opponent draws a card, you may draw two cards.",Creature,Sphinx,BBMMSAFLDMOPMRSCSCPTSUE, green blue, green blue,,control combo,cheat,TRUE
283,1,Primeval Titan,MB,Green,6,{4}{G}{G},6,6,"Trample
Whenever Primeval Titan enters the battlefield or attacks, you may search your library for up to two land cards, put them onto the battlefield tapped, then shuffle your library.",Creature,Giant,BBMMSAFLDMOPMRSCSCPTSUE, green blue, green blue,,control combo,cheat,TRUE
283,1,Torrential Gearhulk,MB,Blue,6,{4}{U}{U},5,6,"Flash
When Torrential Gearhulk enters the battlefield, you may cast target instant card from your graveyard without paying its mana cost. If that card would be put into your graveyard this turn, exile it instead.",Artifact Creature,Construct,BBMMSAFLDMOPMRSCSCPTSUE, green blue, green blue,,control combo,cheat,TRUE
283,1,Sphinx of the Steel Wind,MB,Colorless,8,{5}{W}{U}{B},6,6,"Flying, first strike, vigilance, lifelink, protection from red and from green",Artifact Creature,Sphinx,BBMMSAFLDMOPMRSCSCPTSUE, green blue, green blue,,control combo,cheat,TRUE
283,1,"Ulamog, the Ceaseless Hunger",MB,Colorless,10,{10},10,10,"When you cast this spell, exile two target permanents.
Indestructible
Whenever Ulamog, the Ceaseless Hunger attacks, defending player exiles the top twenty cards of their library.",Creature,Eldrazi,BBMMSAFLDMOPMRSCSCPTSUE, green blue, green blue,,control combo,cheat,TRUE
283,1,"Emrakul, the Promised End",MB,Colorless,13,{13},13,13,"This spell costs {1} less to cast for each card type among cards in your graveyard.
When you cast this spell, you gain control of target opponent during that player's next turn. After that turn, that player takes an extra turn.
Flying, trample, protection from instants",Creature,Eldrazi,BBMMSAFLDMOPMRSCSCPTSUE, green blue, green blue,,control combo,cheat,TRUE
284,1,Breeding Pool,MB,Colorless,0,NA,NA,NA,"({T}: Add {G} or {U}.)
As Breeding Pool enters the battlefield, you may pay 2 life. If you don't, Breeding Pool enters the battlefield tapped.",Land,Forest Island,BEGMRSSVVIRSDGOSSKMSSTSDHMSWUE, red green blue black, green, red blue black,control combo,cheat,FALSE
284,1,Everflowing Chalice,MB,Colorless,0,{0},NA,NA,"Multikicker {2} (You may pay an additional {2} any number of times as you cast this spell.)
Everflowing Chalice enters the battlefield with a charge counter on it for each time it was kicked.
{T}: Add {C} for each charge counter on Everflowing Chalice.",Artifact,NA,BEGMRSSVVIRSDGOSSKMSSTSDHMSWUE, red green blue black, green, red blue black,control combo,cheat,FALSE
284,1,Gemstone Mine,MB,Colorless,0,NA,NA,NA,"Gemstone Mine enters the battlefield with three mining counters on it.
{T}, Remove a mining counter from Gemstone Mine: Add one mana of any color. If there are no mining counters on Gemstone Mine, sacrifice it.",Land,NA,BEGMRSSVVIRSDGOSSKMSSTSDHMSWUE, red green blue black, green, red blue black,control combo,cheat,FALSE
284,1,Mana Confluence,MB,Colorless,0,NA,NA,NA,"{T}, Pay 1 life: Add one mana of any color.",Land,NA,BEGMRSSVVIRSDGOSSKMSSTSDHMSWUE, red green blue black, green, red blue black,control combo,cheat,FALSE
284,1,Raging Ravine,MB,Colorless,0,NA,NA,NA,"Raging Ravine enters the battlefield tapped.
{T}: Add {R} or {G}.
{2}{R}{G}: Until end of turn, Raging Ravine becomes a 3/3 red and green Elemental creature with ""Whenever this creature attacks, put a +1/+1 counter on it."" It's still a land.",Land,NA,BEGMRSSVVIRSDGOSSKMSSTSDHMSWUE, red green blue black, green, red blue black,control combo,cheat,FALSE
284,1,Steam Vents,MB,Colorless,0,NA,NA,NA,"({T}: Add {U} or {R}.)
As Steam Vents enters the battlefield, you may pay 2 life. If you don't, Steam Vents enters the battlefield tapped.",Land,Island Mountain,BEGMRSSVVIRSDGOSSKMSSTSDHMSWUE, red green blue black, green, red blue black,control combo,cheat,FALSE
284,1,Sulfurous Springs,MB,Colorless,0,NA,NA,NA,"{T}: Add {C}.
{T}: Add {B} or {R}. Sulfurous Springs deals 1 damage to you.",Land,NA,BEGMRSSVVIRSDGOSSKMSSTSDHMSWUE, red green blue black, green, red blue black,control combo,cheat,FALSE
284,1,Verdant Catacombs,MB,Colorless,0,NA,NA,NA,"{T}, Pay 1 life, Sacrifice Verdant Catacombs: Search your library for a Swamp or Forest card, put it onto the battlefield, then shuffle your library.",Land,NA,BEGMRSSVVIRSDGOSSKMSSTSDHMSWUE, red green blue black, green, red blue black,control combo,cheat,FALSE
284,1,Volcanic Island,MB,Colorless,0,NA,NA,NA,({T}: Add {U} or {R}.),Land,Island Mountain,BEGMRSSVVIRSDGOSSKMSSTSDHMSWUE, red green blue black, green, red blue black,control combo,cheat,FALSE
284,1,Inquisition of Kozilek,MB,Black,1,{B},NA,NA,Target player reveals their hand. You choose a nonland card from it with converted mana cost 3 or less. That player discards that card.,Sorcery,NA,BEGMRSSVVIRSDGOSSKMSSTSDHMSWUE, red green blue black, green, red blue black,control combo,cheat,FALSE
284,1,Rolling Earthquake,MB,Red,1,{X}{R},NA,NA,Rolling Earthquake deals X damage to each creature without horsemanship and each player.,Sorcery,NA,BEGMRSSVVIRSDGOSSKMSSTSDHMSWUE, red green blue black, green, red blue black,control combo,cheat,FALSE
284,1,Sensei's Divining Top,MB,Colorless,1,{1},NA,NA,"{1}: Look at the top three cards of your library, then put them back in any order.
{T}: Draw a card, then put Sensei's Divining Top on top of its owner's library.",Artifact,NA,BEGMRSSVVIRSDGOSSKMSSTSDHMSWUE, red green blue black, green, red blue black,control combo,cheat,FALSE
284,1,Demonic Tutor,MB,Black,2,{1}{B},NA,NA,Search your library for a card and put that card into your hand. Then shuffle your library.,Sorcery,NA,BEGMRSSVVIRSDGOSSKMSSTSDHMSWUE, red green blue black, green, red blue black,control combo,cheat,FALSE
284,1,Go for the Throat,MB,Black,2,{1}{B},NA,NA,Destroy target nonartifact creature.,Instant,NA,BEGMRSSVVIRSDGOSSKMSSTSDHMSWUE, red green blue black, green, red blue black,control combo,cheat,FALSE
284,1,Oath of Druids,MB,Green,2,{1}{G},NA,NA,"At the beginning of each player's upkeep, that player chooses target player who controls more creatures than they do and is their opponent. The first player may reveal cards from the top of their library until they reveal a creature card. If the first player does, that player puts that card onto the battlefield and all other cards revealed this way into their graveyard.",Enchantment,NA,BEGMRSSVVIRSDGOSSKMSSTSDHMSWUE, red green blue black, green, red blue black,control combo,cheat,FALSE
284,1,Sorcerous Spyglass,MB,Colorless,2,{2},NA,NA,"As Sorcerous Spyglass enters the battlefield, look at an opponent's hand, then choose any card name.
Activated abilities of sources with the chosen name can't be activated unless they're mana abilities.",Artifact,NA,BEGMRSSVVIRSDGOSSKMSSTSDHMSWUE, red green blue black, green, red blue black,control combo,cheat,FALSE
284,1,Sylvan Library,MB,Green,2,{1}{G},NA,NA,"At the beginning of your draw step, you may draw two additional cards. If you do, choose two cards in your hand drawn this turn. For each of those cards, pay 4 life or put the card on top of your library.",Enchantment,NA,BEGMRSSVVIRSDGOSSKMSSTSDHMSWUE, red green blue black, green, red blue black,control combo,cheat,FALSE
284,1,Kodama's Reach,MB,Green,3,{2}{G},NA,NA,"Search your library for up to two basic land cards, reveal those cards, and put one onto the battlefield tapped and the other into your hand. Then shuffle your library.",Sorcery,Arcane,BEGMRSSVVIRSDGOSSKMSSTSDHMSWUE, red green blue black, green, red blue black,control combo,cheat,FALSE
284,1,Maelstrom Pulse,MB,Black Green,3,{1}{B}{G},NA,NA,Destroy target nonland permanent and all other permanents with the same name as that permanent.,Sorcery,NA,BEGMRSSVVIRSDGOSSKMSSTSDHMSWUE, red green blue black, green, red blue black,control combo,cheat,FALSE
284,1,Show and Tell,MB,Blue,3,{2}{U},NA,NA,"Each player may put an artifact, creature, enchantment, or land card from their hand onto the battlefield.",Sorcery,NA,BEGMRSSVVIRSDGOSSKMSSTSDHMSWUE, red green blue black, green, red blue black,control combo,cheat,FALSE
284,1,Sneak Attack,MB,Red,4,{3}{R},NA,NA,{R}: You may put a creature card from your hand onto the battlefield. That creature gains haste. Sacrifice the creature at the beginning of the next end step.,Enchantment,NA,BEGMRSSVVIRSDGOSSKMSSTSDHMSWUE, red green blue black, green, red blue black,control combo,cheat,FALSE
284,1,Through the Breach,MB,Red,5,{4}{R},NA,NA,"You may put a creature card from your hand onto the battlefield. That creature gains haste. Sacrifice that creature at the beginning of the next end step.
Splice onto Arcane {2}{R}{R} (As you cast an Arcane spell, you may reveal this card from your hand and pay its splice cost. If you do, add this card's effects to that spell.)",Instant,Arcane,BEGMRSSVVIRSDGOSSKMSSTSDHMSWUE, red green blue black, green, red blue black,control combo,cheat,FALSE
284,1,Selvala's Stampede,MB,Green,6,{4}{G}{G},NA,NA,"Council's dilemma — Starting with you, each player votes for wild or free. Reveal cards from the top of your library until you reveal a creature card for each wild vote. Put those creature cards onto the battlefield, then shuffle the rest into your library. You may put a permanent card from your hand onto the battlefield for each free vote.",Sorcery,NA,BEGMRSSVVIRSDGOSSKMSSTSDHMSWUE, red green blue black, green, red blue black,control combo,cheat,FALSE
284,1,Dragonlord Atarka,MB,Red Green,7,{5}{R}{G},8,8,"Flying, trample
When Dragonlord Atarka enters the battlefield, it deals 5 damage divided as you choose among any number of target creatures and/or planeswalkers your opponents control.",Creature,Elder Dragon,BEGMRSSVVIRSDGOSSKMSSTSDHMSWUE, red green blue black, green, red blue black,control combo,cheat,FALSE
284,1,Hornet Queen,MB,Green,7,{4}{G}{G}{G},2,2,"Flying
Deathtouch (Any amount of damage this deals to a creature is enough to destroy it.)
When Hornet Queen enters the battlefield, create four 1/1 green Insect creature tokens with flying and deathtouch.",Creature,Insect,BEGMRSSVVIRSDGOSSKMSSTSDHMSWUE, red green blue black, green, red blue black,control combo,cheat,FALSE
284,1,Myr Battlesphere,MB,Colorless,7,{7},4,7,"When Myr Battlesphere enters the battlefield, create four 1/1 colorless Myr artifact creature tokens.
Whenever Myr Battlesphere attacks, you may tap X untapped Myr you control. If you do, Myr Battlesphere gets +X/+0 until end of turn and deals X damage to the player or planeswalker it's attacking.",Artifact Creature,Myr Construct,BEGMRSSVVIRSDGOSSKMSSTSDHMSWUE, red green blue black, green, red blue black,control combo,cheat,FALSE
284,1,Sundering Titan,MB,Colorless,8,{8},7,10,"When Sundering Titan enters the battlefield or leaves the battlefield, choose a land of each basic land type, then destroy those lands.",Artifact Creature,Golem,BEGMRSSVVIRSDGOSSKMSSTSDHMSWUE, red green blue black, green, red blue black,control combo,cheat,FALSE
284,1,Woodfall Primus,MB,Green,8,{5}{G}{G}{G},6,6,"Trample
When Woodfall Primus enters the battlefield, destroy target noncreature permanent.
Persist (When this creature dies, if it had no -1/-1 counters on it, return it to the battlefield under its owner's control with a -1/-1 counter on it.)",Creature,Treefolk Shaman,BEGMRSSVVIRSDGOSSKMSSTSDHMSWUE, red green blue black, green, red blue black,control combo,cheat,FALSE
284,1,"Ulamog, the Ceaseless Hunger",MB,Colorless,10,{10},10,10,"When you cast this spell, exile two target permanents.
Indestructible
Whenever Ulamog, the Ceaseless Hunger attacks, defending player exiles the top twenty cards of their library.",Creature,Eldrazi,BEGMRSSVVIRSDGOSSKMSSTSDHMSWUE, red green blue black, green, red blue black,control combo,cheat,FALSE
284,1,"Emrakul, the Promised End",MB,Colorless,13,{13},13,13,"This spell costs {1} less to cast for each card type among cards in your graveyard.
When you cast this spell, you gain control of target opponent during that player's next turn. After that turn, that player takes an extra turn.
Flying, trample, protection from instants",Creature,Eldrazi,BEGMRSSVVIRSDGOSSKMSSTSDHMSWUE, red green blue black, green, red blue black,control combo,cheat,FALSE
285,1,Carnage Tyrant,MB,Green,6,{4}{G}{G},7,6,"This spell can't be countered.
Trample, hexproof",Creature,Dinosaur,CVGHMVGLESCVHRVSMBCDSPAETJWMFRSSRBTGMPNPMMNLJFSI, green blue black, green blue, black,midrange,,FALSE
285,1,Vampiric Tutor,MB,Black,1,{B},NA,NA,"Search your library for a card, then shuffle your library and put that card on top of it. You lose 2 life.",Instant,NA,CVGHMVGLESCVHRVSMBCDSPAETJWMFRSSRBTGMPNPMMNLJFSI, green blue black, green blue, black,midrange,,FALSE
285,1,Grand Coliseum,MB,Colorless,0,NA,NA,NA,"Grand Coliseum enters the battlefield tapped.
{T}: Add {C}.
{T}: Add one mana of any color. Grand Coliseum deals 1 damage to you.",Land,NA,CVGHMVGLESCVHRVSMBCDSPAETJWMFRSSRBTGMPNPMMNLJFSI, green blue black, green blue, black,midrange,,FALSE
285,1,Hornet Queen,MB,Green,7,{4}{G}{G}{G},2,2,"Flying
Deathtouch (Any amount of damage this deals to a creature is enough to destroy it.)
When Hornet Queen enters the battlefield, create four 1/1 green Insect creature tokens with flying and deathtouch.",Creature,Insect,CVGHMVGLESCVHRVSMBCDSPAETJWMFRSSRBTGMPNPMMNLJFSI, green blue black, green blue, black,midrange,,FALSE
285,1,Mox Diamond,MB,Colorless,0,{0},NA,NA,"If Mox Diamond would enter the battlefield, you may discard a land card instead. If you do, put Mox Diamond onto the battlefield. If you don't, put it into its owner's graveyard.
{T}: Add one mana of any color.",Artifact,NA,CVGHMVGLESCVHRVSMBCDSPAETJWMFRSSRBTGMPNPMMNLJFSI, green blue black, green blue, black,midrange,,FALSE
285,1,Verdant Catacombs,MB,Colorless,0,NA,NA,NA,"{T}, Pay 1 life, Sacrifice Verdant Catacombs: Search your library for a Swamp or Forest card, put it onto the battlefield, then shuffle your library.",Land,NA,CVGHMVGLESCVHRVSMBCDSPAETJWMFRSSRBTGMPNPMMNLJFSI, green blue black, green blue, black,midrange,,FALSE
