deckID,number,name,location,color,cmc,manaCost,power,toughness,text,types,subtypes,key,colors,baseColors,splashes,sphere,archetype,powered
299,1,Oath of Druids,MB,Green,2,{1}{G},NA,NA,"At the beginning of each player's upkeep, that player chooses target player who controls more creatures than they do and is their opponent. The first player may reveal cards from the top of their library until they reveal a creature card. If the first player does, that player puts that card onto the battlefield and all other cards revealed this way into their graveyard.",Enchantment,NA,LSEWCIVACDDOLMWSLGWGKIB, red green blue black, black, red green blue,control combo,cheat,FALSE
299,1,Liliana of the Veil,MB,Black,3,{1}{B}{B},NA,NA,"+1: Each player discards a card.
−2: Target player sacrifices a creature.
−6: Separate all permanents target player controls into two piles. That player sacrifices all permanents in the pile of their choice.",Planeswalker,Liliana,LSEWCIVACDDOLMWSLGWGKIB, red green blue black, black, red green blue,control combo,cheat,FALSE
299,1,Maelstrom Pulse,MB,Black Green,3,{1}{B}{G},NA,NA,Destroy target nonland permanent and all other permanents with the same name as that permanent.,Sorcery,NA,LSEWCIVACDDOLMWSLGWGKIB, red green blue black, black, red green blue,control combo,cheat,FALSE
299,1,Wheel of Fortune,MB,Red,3,{2}{R},NA,NA,"Each player discards their hand, then draws seven cards.",Sorcery,NA,LSEWCIVACDDOLMWSLGWGKIB, red green blue black, black, red green blue,control combo,cheat,FALSE
299,1,Sneak Attack,MB,Red,4,{3}{R},NA,NA,{R}: You may put a creature card from your hand onto the battlefield. That creature gains haste. Sacrifice the creature at the beginning of the next end step.,Enchantment,NA,LSEWCIVACDDOLMWSLGWGKIB, red green blue black, black, red green blue,control combo,cheat,FALSE
299,1,"Liliana, Death's Majesty",MB,Black,5,{3}{B}{B},NA,NA,"+1: Create a 2/2 black Zombie creature token. Put the top two cards of your library into your graveyard.
−3: Return target creature card from your graveyard to the battlefield. That creature is a black Zombie in addition to its other colors and types.
−7: Destroy all non-Zombie creatures.",Planeswalker,Liliana,LSEWCIVACDDOLMWSLGWGKIB, red green blue black, black, red green blue,control combo,cheat,FALSE
299,1,Grave Titan,MB,Black,6,{4}{B}{B},6,6,"Deathtouch
Whenever Grave Titan enters the battlefield or attacks, create two 2/2 black Zombie creature tokens.",Creature,Giant,LSEWCIVACDDOLMWSLGWGKIB, red green blue black, black, red green blue,control combo,cheat,FALSE
299,1,Woodfall Primus,MB,Green,8,{5}{G}{G}{G},6,6,"Trample
When Woodfall Primus enters the battlefield, destroy target noncreature permanent.
Persist (When this creature dies, if it had no -1/-1 counters on it, return it to the battlefield under its owner's control with a -1/-1 counter on it.)",Creature,Treefolk Shaman,LSEWCIVACDDOLMWSLGWGKIB, red green blue black, black, red green blue,control combo,cheat,FALSE
299,1,Greater Gargadon,MB,Red,10,{9}{R},9,7,"Suspend 10—{R}
Sacrifice an artifact, creature, or land: Remove a time counter from Greater Gargadon. Activate this ability only if Greater Gargadon is suspended.",Creature,Beast,LSEWCIVACDDOLMWSLGWGKIB, red green blue black, black, red green blue,control combo,cheat,FALSE
299,1,"Kozilek, Butcher of Truth",MB,Colorless,10,{10},12,12,"When you cast this spell, draw four cards.
Annihilator 4 (Whenever this creature attacks, defending player sacrifices four permanents.)
When Kozilek, Butcher of Truth is put into a graveyard from anywhere, its owner shuffles their graveyard into their library.",Creature,Eldrazi,LSEWCIVACDDOLMWSLGWGKIB, red green blue black, black, red green blue,control combo,cheat,FALSE
299,1,Inkwell Leviathan,MB,Blue,9,{7}{U}{U},7,11,"Trample
Islandwalk (This creature can't be blocked as long as defending player controls an Island.)
Shroud (This creature can't be the target of spells or abilities.)",Artifact Creature,Leviathan,LSEWCIVACDDOLMWSLGWGKIB, red green blue black, black, red green blue,control combo,cheat,FALSE
299,1,Blightsteel Colossus,MB,Colorless,12,{12},11,11,"Trample, infect, indestructible
If Blightsteel Colossus would be put into a graveyard from anywhere, reveal Blightsteel Colossus and shuffle it into its owner's library instead.",Artifact Creature,Golem,LSEWCIVACDDOLMWSLGWGKIB, red green blue black, black, red green blue,control combo,cheat,FALSE
300,1,Celestial Colonnade,MB,Colorless,0,NA,NA,NA,"Celestial Colonnade enters the battlefield tapped.
{T}: Add {W} or {U}.
{3}{W}{U}: Until end of turn, Celestial Colonnade becomes a 4/4 white and blue Elemental creature with flying and vigilance. It's still a land.",Land,NA,CSTWMCMCOSBGJMVCDESVWFKD, red blue white, blue white, red,control,,FALSE
300,1,Scalding Tarn,MB,Colorless,0,NA,NA,NA,"{T}, Pay 1 life, Sacrifice Scalding Tarn: Search your library for an Island or Mountain card, put it onto the battlefield, then shuffle your library.",Land,NA,CSTWMCMCOSBGJMVCDESVWFKD, red blue white, blue white, red,control,,FALSE
300,1,Tropical Island,MB,Colorless,0,NA,NA,NA,({T}: Add {G} or {U}.),Land,Forest Island,CSTWMCMCOSBGJMVCDESVWFKD, red blue white, blue white, red,control,,FALSE
300,1,Windswept Heath,MB,Colorless,0,NA,NA,NA,"{T}, Pay 1 life, Sacrifice Windswept Heath: Search your library for a Forest or Plains card, put it onto the battlefield, then shuffle your library.",Land,NA,CSTWMCMCOSBGJMVCDESVWFKD, red blue white, blue white, red,control,,FALSE
300,1,Mox Diamond,MB,Colorless,0,{0},NA,NA,"If Mox Diamond would enter the battlefield, you may discard a land card instead. If you do, put Mox Diamond onto the battlefield. If you don't, put it into its owner's graveyard.
{T}: Add one mana of any color.",Artifact,NA,CSTWMCMCOSBGJMVCDESVWFKD, red blue white, blue white, red,control,,FALSE
300,1,Chrome Mox,MB,Colorless,0,{0},NA,NA,"Imprint — When Chrome Mox enters the battlefield, you may exile a nonartifact, nonland card from your hand.
{T}: Add one mana of any of the exiled card's colors.",Artifact,NA,CSTWMCMCOSBGJMVCDESVWFKD, red blue white, blue white, red,control,,FALSE
300,1,Mystical Tutor,MB,Blue,1,{U},NA,NA,"Search your library for an instant or sorcery card and reveal that card. Shuffle your library, then put the card on top of it.",Instant,NA,CSTWMCMCOSBGJMVCDESVWFKD, red blue white, blue white, red,control,,FALSE
300,1,Coldsteel Heart,MB,Colorless,2,{2},NA,NA,"Coldsteel Heart enters the battlefield tapped.
As Coldsteel Heart enters the battlefield, choose a color.
{T}: Add one mana of the chosen color.",Artifact,NA,CSTWMCMCOSBGJMVCDESVWFKD, red blue white, blue white, red,control,,FALSE
300,1,Orzhov Signet,MB,Colorless,2,{2},NA,NA,"{1}, {T}: Add {W}{B}.",Artifact,NA,CSTWMCMCOSBGJMVCDESVWFKD, red blue white, blue white, red,control,,FALSE
300,1,Snapcaster Mage,MB,Blue,2,{1}{U},2,1,"Flash
When Snapcaster Mage enters the battlefield, target instant or sorcery card in your graveyard gains flashback until end of turn. The flashback cost is equal to its mana cost. (You may cast that card from your graveyard for its flashback cost. Then exile it.)",Creature,Human Wizard,CSTWMCMCOSBGJMVCDESVWFKD, red blue white, blue white, red,control,,FALSE
300,1,Banishing Light,MB,White,3,{2}{W},NA,NA,"When Banishing Light enters the battlefield, exile target nonland permanent an opponent controls until Banishing Light leaves the battlefield. (That permanent returns under its owner's control.)",Enchantment,NA,CSTWMCMCOSBGJMVCDESVWFKD, red blue white, blue white, red,control,,FALSE
300,1,Geist of Saint Traft,MB,White Blue,3,{1}{W}{U},2,2,"Hexproof (This creature can't be the target of spells or abilities your opponents control.)
Whenever Geist of Saint Traft attacks, create a 4/4 white Angel creature token with flying that's tapped and attacking. Exile that token at end of combat.",Creature,Spirit Cleric,CSTWMCMCOSBGJMVCDESVWFKD, red blue white, blue white, red,control,,FALSE
300,1,Jace Beleren,MB,Blue,3,{1}{U}{U},NA,NA,"+2: Each player draws a card.
−1: Target player draws a card.
−10: Target player puts the top twenty cards of their library into their graveyard.",Planeswalker,Jace,CSTWMCMCOSBGJMVCDESVWFKD, red blue white, blue white, red,control,,FALSE
300,1,Monastery Mentor,MB,White,3,{2}{W},2,2,"Prowess (Whenever you cast a noncreature spell, this creature gets +1/+1 until end of turn.)
Whenever you cast a noncreature spell, create a 1/1 white Monk creature token with prowess.",Creature,Human Monk,CSTWMCMCOSBGJMVCDESVWFKD, red blue white, blue white, red,control,,FALSE
300,1,Vedalken Shackles,MB,Colorless,3,{3},NA,NA,"You may choose not to untap Vedalken Shackles during your untap step.
{2}, {T}: Gain control of target creature with power less than or equal to the number of Islands you control for as long as Vedalken Shackles remains tapped.",Artifact,NA,CSTWMCMCOSBGJMVCDESVWFKD, red blue white, blue white, red,control,,FALSE
300,1,Cryptic Command,MB,Blue,4,{1}{U}{U}{U},NA,NA,"Choose two —
• Counter target spell.
• Return target permanent to its owner's hand.
• Tap all creatures your opponents control.
• Draw a card.",Instant,NA,CSTWMCMCOSBGJMVCDESVWFKD, red blue white, blue white, red,control,,FALSE
300,1,Deep Analysis,MB,Blue,4,{3}{U},NA,NA,"Target player draws two cards.
Flashback—{1}{U}, Pay 3 life. (You may cast this card from your graveyard for its flashback cost. Then exile it.)",Sorcery,NA,CSTWMCMCOSBGJMVCDESVWFKD, red blue white, blue white, red,control,,FALSE
300,1,"Elspeth, Knight-Errant",MB,White,4,{2}{W}{W},NA,NA,"+1: Create a 1/1 white Soldier creature token.
+1: Target creature gets +3/+3 and gains flying until end of turn.
−8: You get an emblem with ""Artifacts, creatures, enchantments, and lands you control have indestructible.""",Planeswalker,Elspeth,CSTWMCMCOSBGJMVCDESVWFKD, red blue white, blue white, red,control,,FALSE
300,1,Supreme Verdict,MB,White Blue,4,{1}{W}{W}{U},NA,NA,"This spell can't be countered.
Destroy all creatures.",Sorcery,NA,CSTWMCMCOSBGJMVCDESVWFKD, red blue white, blue white, red,control,,FALSE
300,1,"Venser, Shaper Savant",MB,Blue,4,{2}{U}{U},2,2,"Flash
When Venser, Shaper Savant enters the battlefield, return target spell or permanent to its owner's hand.",Creature,Human Wizard,CSTWMCMCOSBGJMVCDESVWFKD, red blue white, blue white, red,control,,FALSE
300,1,Wrath of God,MB,White,4,{2}{W}{W},NA,NA,Destroy all creatures. They can't be regenerated.,Sorcery,NA,CSTWMCMCOSBGJMVCDESVWFKD, red blue white, blue white, red,control,,FALSE
300,1,Fractured Identity,MB,White Blue,5,{3}{W}{U},NA,NA,Exile target nonland permanent. Each player other than its controller creates a token that's a copy of it.,Sorcery,NA,CSTWMCMCOSBGJMVCDESVWFKD, red blue white, blue white, red,control,,FALSE
300,1,"Keranos, God of Storms",MB,Blue Red,5,{3}{U}{R},6,5,"Indestructible
As long as your devotion to blue and red is less than seven, Keranos isn't a creature.
Reveal the first card you draw on each of your turns. Whenever you reveal a land card this way, draw a card. Whenever you reveal a nonland card this way, Keranos deals 3 damage to any target.",Enchantment Creature,God,CSTWMCMCOSBGJMVCDESVWFKD, red blue white, blue white, red,control,,FALSE
300,1,Dig Through Time,MB,Blue,8,{6}{U}{U},NA,NA,"Delve (Each card you exile from your graveyard while casting this spell pays for {1}.)
Look at the top seven cards of your library. Put two of them into your hand and the rest on the bottom of your library in any order.",Instant,NA,CSTWMCMCOSBGJMVCDESVWFKD, red blue white, blue white, red,control,,FALSE
301,1,Arid Mesa,MB,Colorless,0,NA,NA,NA,"{T}, Pay 1 life, Sacrifice Arid Mesa: Search your library for a Mountain or Plains card, put it onto the battlefield, then shuffle your library.",Land,NA,AGMSWCABITBCDDRVDFSSVFKSI, red blue white, red blue, white,control combo,twin,FALSE
301,1,Grand Coliseum,MB,Colorless,0,NA,NA,NA,"Grand Coliseum enters the battlefield tapped.
{T}: Add {C}.
{T}: Add one mana of any color. Grand Coliseum deals 1 damage to you.",Land,NA,AGMSWCABITBCDDRVDFSSVFKSI, red blue white, red blue, white,control combo,twin,FALSE
301,1,Mana Confluence,MB,Colorless,0,NA,NA,NA,"{T}, Pay 1 life: Add one mana of any color.",Land,NA,AGMSWCABITBCDDRVDFSSVFKSI, red blue white, red blue, white,control combo,twin,FALSE
301,1,Sacred Foundry,MB,Colorless,0,NA,NA,NA,"({T}: Add {R} or {W}.)
As Sacred Foundry enters the battlefield, you may pay 2 life. If you don't, it enters the battlefield tapped.",Land,Mountain Plains,AGMSWCABITBCDDRVDFSSVFKSI, red blue white, red blue, white,control combo,twin,FALSE
301,1,Wandering Fumarole,MB,Colorless,0,NA,NA,NA,"Wandering Fumarole enters the battlefield tapped.
{T}: Add {U} or {R}.
{2}{U}{R}: Until end of turn, Wandering Fumarole becomes a 1/4 blue and red Elemental creature with ""{0}: Switch this creature's power and toughness until end of turn."" It's still a land.",Land,NA,AGMSWCABITBCDDRVDFSSVFKSI, red blue white, red blue, white,control combo,twin,FALSE
301,1,Chrome Mox,MB,Colorless,0,{0},NA,NA,"Imprint — When Chrome Mox enters the battlefield, you may exile a nonartifact, nonland card from your hand.
{T}: Add one mana of any of the exiled card's colors.",Artifact,NA,AGMSWCABITBCDDRVDFSSVFKSI, red blue white, red blue, white,control combo,twin,FALSE
301,1,Ancestral Vision,MB,Blue,0,NA,NA,NA,"Suspend 4—{U} (Rather than cast this card from your hand, pay {U} and exile it with four time counters on it. At the beginning of your upkeep, remove a time counter. When the last is removed, cast it without paying its mana cost.)
Target player draws three cards.",Sorcery,NA,AGMSWCABITBCDDRVDFSSVFKSI, red blue white, red blue, white,control combo,twin,FALSE
301,1,Boros Signet,MB,Colorless,2,{2},NA,NA,"{1}, {T}: Add {R}{W}.",Artifact,NA,AGMSWCABITBCDDRVDFSSVFKSI, red blue white, red blue, white,control combo,twin,FALSE
301,1,Izzet Charm,MB,Blue Red,2,{U}{R},NA,NA,"Choose one —
• Counter target noncreature spell unless its controller pays {2}.
• Izzet Charm deals 2 damage to target creature.
• Draw two cards, then discard two cards.",Instant,NA,AGMSWCABITBCDDRVDFSSVFKSI, red blue white, red blue, white,control combo,twin,FALSE
301,1,Talisman of Unity,MB,Colorless,2,{2},NA,NA,"{T}: Add {C}.
{T}: Add {G} or {W}. Talisman of Unity deals 1 damage to you.",Artifact,NA,AGMSWCABITBCDDRVDFSSVFKSI, red blue white, red blue, white,control combo,twin,FALSE
301,1,Blade Splicer,MB,White,3,{2}{W},1,1,"When Blade Splicer enters the battlefield, create a 3/3 colorless Golem artifact creature token.
Golem creatures you control have first strike.",Creature,Human Artificer,AGMSWCABITBCDDRVDFSSVFKSI, red blue white, red blue, white,control combo,twin,FALSE
301,1,Combat Celebrant,MB,Red,3,{2}{R},4,1,"If Combat Celebrant hasn't been exerted this turn, you may exert it as it attacks. When you do, untap all other creatures you control and after this phase, there is an additional combat phase. (An exerted creature won't untap during your next untap step.)",Creature,Human Warrior,AGMSWCABITBCDDRVDFSSVFKSI, red blue white, red blue, white,control combo,twin,FALSE
301,1,Dack Fayden,MB,Blue Red,3,{1}{U}{R},NA,NA,"+1: Target player draws two cards, then discards two cards.
−2: Gain control of target artifact.
−6: You get an emblem with ""Whenever you cast a spell that targets one or more permanents, gain control of those permanents.""",Planeswalker,Dack,AGMSWCABITBCDDRVDFSSVFKSI, red blue white, red blue, white,control combo,twin,FALSE
301,1,Deceiver Exarch,MB,Blue,3,{2}{U},1,4,"Flash (You may cast this spell any time you could cast an instant.)
When Deceiver Exarch enters the battlefield, choose one —
• Untap target permanent you control.
• Tap target permanent an opponent controls.",Creature,Cleric,AGMSWCABITBCDDRVDFSSVFKSI, red blue white, red blue, white,control combo,twin,FALSE
301,1,Recruiter of the Guard,MB,White,3,{2}{W},1,1,"When Recruiter of the Guard enters the battlefield, you may search your library for a creature card with toughness 2 or less, reveal it, put it into your hand, then shuffle your library.",Creature,Human Soldier,AGMSWCABITBCDDRVDFSSVFKSI, red blue white, red blue, white,control combo,twin,FALSE
301,1,Vendilion Clique,MB,Blue,3,{1}{U}{U},3,1,"Flash
Flying
When Vendilion Clique enters the battlefield, look at target player's hand. You may choose a nonland card from it. If you do, that player reveals the chosen card, puts it on the bottom of their library, then draws a card.",Creature,Faerie Wizard,AGMSWCABITBCDDRVDFSSVFKSI, red blue white, red blue, white,control combo,twin,FALSE
301,1,Deep Analysis,MB,Blue,4,{3}{U},NA,NA,"Target player draws two cards.
Flashback—{1}{U}, Pay 3 life. (You may cast this card from your graveyard for its flashback cost. Then exile it.)",Sorcery,NA,AGMSWCABITBCDDRVDFSSVFKSI, red blue white, red blue, white,control combo,twin,FALSE
301,1,Flametongue Kavu,MB,Red,4,{3}{R},4,2,"When Flametongue Kavu enters the battlefield, it deals 4 damage to target creature.",Creature,Kavu,AGMSWCABITBCDDRVDFSSVFKSI, red blue white, red blue, white,control combo,twin,FALSE
301,1,Sower of Temptation,MB,Blue,4,{2}{U}{U},2,2,"Flying
When Sower of Temptation enters the battlefield, gain control of target creature for as long as Sower of Temptation remains on the battlefield.",Creature,Faerie Wizard,AGMSWCABITBCDDRVDFSSVFKSI, red blue white, red blue, white,control combo,twin,FALSE
301,1,Splinter Twin,MB,Red,4,{2}{R}{R},NA,NA,"Enchant creature
Enchanted creature has ""{T}: Create a token that's a copy of this creature, except it has haste. Exile that token at the beginning of the next end step.""",Enchantment,Aura,AGMSWCABITBCDDRVDFSSVFKSI, red blue white, red blue, white,control combo,twin,FALSE
301,1,"Venser, Shaper Savant",MB,Blue,4,{2}{U}{U},2,2,"Flash
When Venser, Shaper Savant enters the battlefield, return target spell or permanent to its owner's hand.",Creature,Human Wizard,AGMSWCABITBCDDRVDFSSVFKSI, red blue white, red blue, white,control combo,twin,FALSE
301,1,Fractured Identity,MB,White Blue,5,{3}{W}{U},NA,NA,Exile target nonland permanent. Each player other than its controller creates a token that's a copy of it.,Sorcery,NA,AGMSWCABITBCDDRVDFSSVFKSI, red blue white, red blue, white,control combo,twin,FALSE
301,1,"Kiki-Jiki, Mirror Breaker",MB,Red,5,{2}{R}{R}{R},2,2,"Haste
{T}: Create a token that's a copy of target nonlegendary creature you control, except it has haste. Sacrifice it at the beginning of the next end step.",Creature,Goblin Shaman,AGMSWCABITBCDDRVDFSSVFKSI, red blue white, red blue, white,control combo,twin,FALSE
301,1,Siege-Gang Commander,MB,Red,5,{3}{R}{R},2,2,"When Siege-Gang Commander enters the battlefield, create three 1/1 red Goblin creature tokens.
{1}{R}, Sacrifice a Goblin: Siege-Gang Commander deals 2 damage to any target.",Creature,Goblin,AGMSWCABITBCDDRVDFSSVFKSI, red blue white, red blue, white,control combo,twin,FALSE
301,1,Inferno Titan,MB,Red,6,{4}{R}{R},6,6,"{R}: Inferno Titan gets +1/+0 until end of turn.
Whenever Inferno Titan enters the battlefield or attacks, it deals 3 damage divided as you choose among one, two, or three targets.",Creature,Giant,AGMSWCABITBCDDRVDFSSVFKSI, red blue white, red blue, white,control combo,twin,FALSE
302,1,Yavimaya Coast,MB,Colorless,0,NA,NA,NA,"{T}: Add {C}.
{T}: Add {G} or {U}. Yavimaya Coast deals 1 damage to you.",Land,NA,YSVBTCFLMGVIEBPBLWARFLIMSHFBD, red green blue black, green black, red blue,midrange,,FALSE
302,1,Stomping Ground,MB,Colorless,0,NA,NA,NA,"({T}: Add {R} or {G}.)
As Stomping Ground enters the battlefield, you may pay 2 life. If you don't, Stomping Ground enters the battlefield tapped.",Land,Mountain Forest,YSVBTCFLMGVIEBPBLWARFLIMSHFBD, red green blue black, green black, red blue,midrange,,FALSE
302,1,Verdant Catacombs,MB,Colorless,0,NA,NA,NA,"{T}, Pay 1 life, Sacrifice Verdant Catacombs: Search your library for a Swamp or Forest card, put it onto the battlefield, then shuffle your library.",Land,NA,YSVBTCFLMGVIEBPBLWARFLIMSHFBD, red green blue black, green black, red blue,midrange,,FALSE
302,1,Bloodstained Mire,MB,Colorless,0,NA,NA,NA,"{T}, Pay 1 life, Sacrifice Bloodstained Mire: Search your library for a Swamp or Mountain card, put it onto the battlefield, then shuffle your library.",Land,NA,YSVBTCFLMGVIEBPBLWARFLIMSHFBD, red green blue black, green black, red blue,midrange,,FALSE
302,1,Tropical Island,MB,Colorless,0,NA,NA,NA,({T}: Add {G} or {U}.),Land,Forest Island,YSVBTCFLMGVIEBPBLWARFLIMSHFBD, red green blue black, green black, red blue,midrange,,FALSE
302,1,Creeping Tar Pit,MB,Colorless,0,NA,NA,NA,"Creeping Tar Pit enters the battlefield tapped.
{T}: Add {U} or {B}.
{1}{U}{B}: Creeping Tar Pit becomes a 3/2 blue and black Elemental creature until end of turn and can't be blocked this turn. It's still a land.",Land,NA,YSVBTCFLMGVIEBPBLWARFLIMSHFBD, red green blue black, green black, red blue,midrange,,FALSE
302,1,Flooded Strand,MB,Colorless,0,NA,NA,NA,"{T}, Pay 1 life, Sacrifice Flooded Strand: Search your library for a Plains or Island card, put it onto the battlefield, then shuffle your library.",Land,NA,YSVBTCFLMGVIEBPBLWARFLIMSHFBD, red green blue black, green black, red blue,midrange,,FALSE
302,1,Lumbering Falls,MB,Colorless,0,NA,NA,NA,"Lumbering Falls enters the battlefield tapped.
{T}: Add {G} or {U}.
{2}{G}{U}: Lumbering Falls becomes a 3/3 green and blue Elemental creature with hexproof until end of turn. It's still a land.",Land,NA,YSVBTCFLMGVIEBPBLWARFLIMSHFBD, red green blue black, green black, red blue,midrange,,FALSE
302,1,Misty Rainforest,MB,Colorless,0,NA,NA,NA,"{T}, Pay 1 life, Sacrifice Misty Rainforest: Search your library for a Forest or Island card, put it onto the battlefield, then shuffle your library.",Land,NA,YSVBTCFLMGVIEBPBLWARFLIMSHFBD, red green blue black, green black, red blue,midrange,,FALSE
302,1,Green Sun's Zenith,MB,Green,1,{X}{G},NA,NA,"Search your library for a green creature card with converted mana cost X or less, put it onto the battlefield, then shuffle your library. Shuffle Green Sun's Zenith into its owner's library.",Sorcery,NA,YSVBTCFLMGVIEBPBLWARFLIMSHFBD, red green blue black, green black, red blue,midrange,,FALSE
302,1,Vampiric Tutor,MB,Black,1,{B},NA,NA,"Search your library for a card, then shuffle your library and put that card on top of it. You lose 2 life.",Instant,NA,YSVBTCFLMGVIEBPBLWARFLIMSHFBD, red green blue black, green black, red blue,midrange,,FALSE
302,1,Inquisition of Kozilek,MB,Black,1,{B},NA,NA,Target player reveals their hand. You choose a nonland card from it with converted mana cost 3 or less. That player discards that card.,Sorcery,NA,YSVBTCFLMGVIEBPBLWARFLIMSHFBD, red green blue black, green black, red blue,midrange,,FALSE
302,1,Elvish Mystic,MB,Green,1,{G},1,1,{T}: Add {G}.,Creature,Elf Druid,YSVBTCFLMGVIEBPBLWARFLIMSHFBD, red green blue black, green black, red blue,midrange,,FALSE
302,1,Birds of Paradise,MB,Green,1,{G},0,1,"Flying
{T}: Add one mana of any color.",Creature,Bird,YSVBTCFLMGVIEBPBLWARFLIMSHFBD, red green blue black, green black, red blue,midrange,,FALSE
302,1,Pack Rat,MB,Black,2,{1}{B},*,*,"Pack Rat's power and toughness are each equal to the number of Rats you control.
{2}{B}, Discard a card: Create a token that's a copy of Pack Rat.",Creature,Rat,YSVBTCFLMGVIEBPBLWARFLIMSHFBD, red green blue black, green black, red blue,midrange,,FALSE
302,1,Baleful Strix,MB,Blue Black,2,{U}{B},1,1,"Flying, deathtouch
When Baleful Strix enters the battlefield, draw a card.",Artifact Creature,Bird,YSVBTCFLMGVIEBPBLWARFLIMSHFBD, red green blue black, green black, red blue,midrange,,FALSE
302,1,Looter il-Kor,MB,Blue,2,{1}{U},1,1,"Shadow (This creature can block or be blocked by only creatures with shadow.)
Whenever Looter il-Kor deals damage to an opponent, draw a card, then discard a card.",Creature,Kor Rogue,YSVBTCFLMGVIEBPBLWARFLIMSHFBD, red green blue black, green black, red blue,midrange,,FALSE
302,1,Wall of Roots,MB,Green,2,{1}{G},0,5,"Defender
Put a -0/-1 counter on Wall of Roots: Add {G}. Activate this ability only once each turn.",Creature,Plant Wall,YSVBTCFLMGVIEBPBLWARFLIMSHFBD, red green blue black, green black, red blue,midrange,,FALSE
302,1,Asylum Visitor,MB,Black,2,{1}{B},3,1,"At the beginning of each player's upkeep, if that player has no cards in hand, you draw a card and you lose 1 life.
Madness {1}{B} (If you discard this card, discard it into exile. When you do, cast it for its madness cost or put it into your graveyard.)",Creature,Vampire Wizard,YSVBTCFLMGVIEBPBLWARFLIMSHFBD, red green blue black, green black, red blue,midrange,,FALSE
302,1,Recurring Nightmare,MB,Black,3,{2}{B},NA,NA,"Sacrifice a creature, Return Recurring Nightmare to its owner's hand: Return target creature card from your graveyard to the battlefield. Activate this ability only any time you could cast a sorcery.",Enchantment,NA,YSVBTCFLMGVIEBPBLWARFLIMSHFBD, red green blue black, green black, red blue,midrange,,FALSE
302,1,Flesh Carver,MB,Black,3,{2}{B},2,2,"Intimidate (This creature can't be blocked except by artifact creatures and/or creatures that share a color with it.)
{1}{B}, Sacrifice another creature: Put two +1/+1 counters on Flesh Carver.
When Flesh Carver dies, create an X/X black Horror creature token, where X is Flesh Carver's power.",Creature,Human Wizard,YSVBTCFLMGVIEBPBLWARFLIMSHFBD, red green blue black, green black, red blue,midrange,,FALSE
302,1,Liliana of the Veil,MB,Black,3,{1}{B}{B},NA,NA,"+1: Each player discards a card.
−2: Target player sacrifices a creature.
−6: Separate all permanents target player controls into two piles. That player sacrifices all permanents in the pile of their choice.",Planeswalker,Liliana,YSVBTCFLMGVIEBPBLWARFLIMSHFBD, red green blue black, green black, red blue,midrange,,FALSE
