deckID,number,name,location,color,cmc,manaCost,power,toughness,text,types,subtypes,key,colors,baseColors,splashes,sphere,archetype,powered
263,1,Manglehorn,SB,Green,3,{2}{G},2,2,"When Manglehorn enters the battlefield, you may destroy target artifact.
Artifacts your opponents control enter the battlefield tapped.",Creature,Beast,SEKCTLBASMESSVTCCCBSDVCSAMDDDGJTTPFRWGHEFKSMESIP, blue black white, blue black, white,control,,FALSE
263,1,Earthshaker Khenra,SB,Red,2,{1}{R},2,1,"Haste
When Earthshaker Khenra enters the battlefield, target creature with power less than or equal to Earthshaker Khenra's power can't block this turn.
Eternalize {4}{R}{R} ({4}{R}{R}, Exile this card from your graveyard: Create a token that's a copy of it, except it's a 4/4 black Zombie Jackal Warrior with no mana cost. Eternalize only as a sorcery.)",Creature,Jackal Warrior,SEKCTLBASMESSVTCCCBSDVCSAMDDDGJTTPFRWGHEFKSMESIP, blue black white, blue black, white,control,,FALSE
263,2,Swamp,MB,Colorless,0,NA,NA,NA,NA,Land,Swamp,SEKCTLBASMESSVTCCCBSDVCSAMDDDGJTTPFRWGHEFKSMESIP, blue black white, blue black, white,control,,FALSE
263,4,Island,MB,Colorless,0,NA,NA,NA,NA,Land,Island,SEKCTLBASMESSVTCCCBSDVCSAMDDDGJTTPFRWGHEFKSMESIP, blue black white, blue black, white,control,,FALSE
263,1,Plains,MB,Colorless,0,NA,NA,NA,NA,Land,Plains,SEKCTLBASMESSVTCCCBSDVCSAMDDDGJTTPFRWGHEFKSMESIP, blue black white, blue black, white,control,,FALSE
264,1,Misty Rainforest,MB,Colorless,0,NA,NA,NA,"{T}, Pay 1 life, Sacrifice Misty Rainforest: Search your library for a Forest or Island card, put it onto the battlefield, then shuffle your library.",Land,NA,MHFAPLWBNJPNWSSCWNTRCJMSFPMVTHM, green blue white, green blue, white,midrange,,FALSE
264,1,Hallowed Fountain,MB,Colorless,0,NA,NA,NA,"({T}: Add {W} or {U}.)
As Hallowed Fountain enters the battlefield, you may pay 2 life. If you don't, Hallowed Fountain enters the battlefield tapped.",Land,Plains Island,MHFAPLWBNJPNWSSCWNTRCJMSFPMVTHM, green blue white, green blue, white,midrange,,FALSE
264,1,Flooded Strand,MB,Colorless,0,NA,NA,NA,"{T}, Pay 1 life, Sacrifice Flooded Strand: Search your library for a Plains or Island card, put it onto the battlefield, then shuffle your library.",Land,NA,MHFAPLWBNJPNWSSCWNTRCJMSFPMVTHM, green blue white, green blue, white,midrange,,FALSE
264,1,Adarkar Wastes,MB,Colorless,0,NA,NA,NA,"{T}: Add {C}.
{T}: Add {W} or {U}. Adarkar Wastes deals 1 damage to you.",Land,NA,MHFAPLWBNJPNWSSCWNTRCJMSFPMVTHM, green blue white, green blue, white,midrange,,FALSE
264,1,Polluted Delta,MB,Colorless,0,NA,NA,NA,"{T}, Pay 1 life, Sacrifice Polluted Delta: Search your library for an Island or Swamp card, put it onto the battlefield, then shuffle your library.",Land,NA,MHFAPLWBNJPNWSSCWNTRCJMSFPMVTHM, green blue white, green blue, white,midrange,,FALSE
264,1,Lumbering Falls,MB,Colorless,0,NA,NA,NA,"Lumbering Falls enters the battlefield tapped.
{T}: Add {G} or {U}.
{2}{G}{U}: Lumbering Falls becomes a 3/3 green and blue Elemental creature with hexproof until end of turn. It's still a land.",Land,NA,MHFAPLWBNJPNWSSCWNTRCJMSFPMVTHM, green blue white, green blue, white,midrange,,FALSE
264,1,Windswept Heath,MB,Colorless,0,NA,NA,NA,"{T}, Pay 1 life, Sacrifice Windswept Heath: Search your library for a Forest or Plains card, put it onto the battlefield, then shuffle your library.",Land,NA,MHFAPLWBNJPNWSSCWNTRCJMSFPMVTHM, green blue white, green blue, white,midrange,,FALSE
264,1,Breeding Pool,MB,Colorless,0,NA,NA,NA,"({T}: Add {G} or {U}.)
As Breeding Pool enters the battlefield, you may pay 2 life. If you don't, Breeding Pool enters the battlefield tapped.",Land,Forest Island,MHFAPLWBNJPNWSSCWNTRCJMSFPMVTHM, green blue white, green blue, white,midrange,,FALSE
264,1,Noble Hierarch,MB,Green,1,{G},0,1,"Exalted (Whenever a creature you control attacks alone, that creature gets +1/+1 until end of turn.)
{T}: Add {G}, {W}, or {U}.",Creature,Human Druid,MHFAPLWBNJPNWSSCWNTRCJMSFPMVTHM, green blue white, green blue, white,midrange,,FALSE
264,1,Joraga Treespeaker,MB,Green,1,{G},1,1,"Level up {1}{G} ({1}{G}: Put a level counter on this. Level up only as a sorcery.)
LEVEL 1-4
1/2
{T}: Add {G}{G}.
LEVEL 5+
1/4
Elves you control have ""{T}: Add {G}{G}.""",Creature,Elf Druid,MHFAPLWBNJPNWSSCWNTRCJMSFPMVTHM, green blue white, green blue, white,midrange,,FALSE
264,1,Path to Exile,MB,White,1,{W},NA,NA,"Exile target creature. Its controller may search their library for a basic land card, put that card onto the battlefield tapped, then shuffle their library.",Instant,NA,MHFAPLWBNJPNWSSCWNTRCJMSFPMVTHM, green blue white, green blue, white,midrange,,FALSE
264,1,"Nissa, Steward of Elements",MB,Blue Green,2,{X}{G}{U},NA,NA,"+2: Scry 2.
0: Look at the top card of your library. If it's a land card or a creature card with converted mana cost less than or equal to the number of loyalty counters on Nissa, Steward of Elements, you may put that card onto the battlefield.
−6: Untap up to two target lands you control. They become 5/5 Elemental creatures with flying and haste until end of turn. They're still lands.",Planeswalker,Nissa,MHFAPLWBNJPNWSSCWNTRCJMSFPMVTHM, green blue white, green blue, white,midrange,,FALSE
264,1,Wall of Omens,MB,White,2,{1}{W},0,4,"Defender
When Wall of Omens enters the battlefield, draw a card.",Creature,Wall,MHFAPLWBNJPNWSSCWNTRCJMSFPMVTHM, green blue white, green blue, white,midrange,,FALSE
264,1,Simic Signet,MB,Colorless,2,{2},NA,NA,"{1}, {T}: Add {G}{U}.",Artifact,NA,MHFAPLWBNJPNWSSCWNTRCJMSFPMVTHM, green blue white, green blue, white,midrange,,FALSE
264,1,Sylvan Caryatid,MB,Green,2,{1}{G},0,3,"Defender, hexproof
{T}: Add one mana of any color.",Creature,Plant,MHFAPLWBNJPNWSSCWNTRCJMSFPMVTHM, green blue white, green blue, white,midrange,,FALSE
264,1,Coldsteel Heart,MB,Colorless,2,{2},NA,NA,"Coldsteel Heart enters the battlefield tapped.
As Coldsteel Heart enters the battlefield, choose a color.
{T}: Add one mana of the chosen color.",Artifact,NA,MHFAPLWBNJPNWSSCWNTRCJMSFPMVTHM, green blue white, green blue, white,midrange,,FALSE
264,1,Walking Ballista,MB,Colorless,0,{X}{X},0,0,"Walking Ballista enters the battlefield with X +1/+1 counters on it.
{4}: Put a +1/+1 counter on Walking Ballista.
Remove a +1/+1 counter from Walking Ballista: It deals 1 damage to any target.",Artifact Creature,Construct,MHFAPLWBNJPNWSSCWNTRCJMSFPMVTHM, green blue white, green blue, white,midrange,,FALSE
264,1,"Nissa, Voice of Zendikar",MB,Green,3,{1}{G}{G},NA,NA,"+1: Create a 0/1 green Plant creature token.
−2: Put a +1/+1 counter on each creature you control.
−7: You gain X life and draw X cards, where X is the number of lands you control.",Planeswalker,Nissa,MHFAPLWBNJPNWSSCWNTRCJMSFPMVTHM, green blue white, green blue, white,midrange,,FALSE
264,1,Thirst for Knowledge,MB,Blue,3,{2}{U},NA,NA,Draw three cards. Then discard two cards unless you discard an artifact card.,Instant,NA,MHFAPLWBNJPNWSSCWNTRCJMSFPMVTHM, green blue white, green blue, white,midrange,,FALSE
264,1,Recruiter of the Guard,MB,White,3,{2}{W},1,1,"When Recruiter of the Guard enters the battlefield, you may search your library for a creature card with toughness 2 or less, reveal it, put it into your hand, then shuffle your library.",Creature,Human Soldier,MHFAPLWBNJPNWSSCWNTRCJMSFPMVTHM, green blue white, green blue, white,midrange,,FALSE
264,1,Courser of Kruphix,MB,Green,3,{1}{G}{G},2,4,"Play with the top card of your library revealed.
You may play the top card of your library if it's a land card.
Whenever a land enters the battlefield under your control, you gain 1 life.",Enchantment Creature,Centaur,MHFAPLWBNJPNWSSCWNTRCJMSFPMVTHM, green blue white, green blue, white,midrange,,FALSE
264,1,"Jace, the Mind Sculptor",MB,Blue,4,{2}{U}{U},NA,NA,"+2: Look at the top card of target player's library. You may put that card on the bottom of that player's library.
0: Draw three cards, then put two cards from your hand on top of your library in any order.
−1: Return target creature to its owner's hand.
−12: Exile all cards from target player's library, then that player shuffles their hand into their library.",Planeswalker,Jace,MHFAPLWBNJPNWSSCWNTRCJMSFPMVTHM, green blue white, green blue, white,midrange,,FALSE
264,1,Mystic Snake,MB,Blue Green,4,{1}{G}{U}{U},2,2,"Flash
When Mystic Snake enters the battlefield, counter target spell.",Creature,Snake,MHFAPLWBNJPNWSSCWNTRCJMSFPMVTHM, green blue white, green blue, white,midrange,,FALSE
264,1,Sower of Temptation,MB,Blue,4,{2}{U}{U},2,2,"Flying
When Sower of Temptation enters the battlefield, gain control of target creature for as long as Sower of Temptation remains on the battlefield.",Creature,Faerie Wizard,MHFAPLWBNJPNWSSCWNTRCJMSFPMVTHM, green blue white, green blue, white,midrange,,FALSE
264,1,Fact or Fiction,MB,Blue,4,{3}{U},NA,NA,Reveal the top five cards of your library. An opponent separates those cards into two piles. Put one pile into your hand and the other into your graveyard.,Instant,NA,MHFAPLWBNJPNWSSCWNTRCJMSFPMVTHM, green blue white, green blue, white,midrange,,FALSE
264,1,Phyrexian Metamorph,MB,Colorless,4,{3}{U/P},0,0,"({U/P} can be paid with either {U} or 2 life.)
You may have Phyrexian Metamorph enter the battlefield as a copy of any artifact or creature on the battlefield, except it's an artifact in addition to its other types.",Artifact Creature,Shapeshifter,MHFAPLWBNJPNWSSCWNTRCJMSFPMVTHM, green blue white, green blue, white,midrange,,FALSE
264,1,Mirari's Wake,MB,White Green,5,{3}{G}{W},NA,NA,"Creatures you control get +1/+1.
Whenever you tap a land for mana, add one mana of any type that land produced.",Enchantment,NA,MHFAPLWBNJPNWSSCWNTRCJMSFPMVTHM, green blue white, green blue, white,midrange,,FALSE
264,1,Verdurous Gearhulk,MB,Green,5,{3}{G}{G},4,4,"Trample
When Verdurous Gearhulk enters the battlefield, distribute four +1/+1 counters among any number of target creatures you control.",Artifact Creature,Construct,MHFAPLWBNJPNWSSCWNTRCJMSFPMVTHM, green blue white, green blue, white,midrange,,FALSE
264,1,Torrential Gearhulk,MB,Blue,6,{4}{U}{U},5,6,"Flash
When Torrential Gearhulk enters the battlefield, you may cast target instant card from your graveyard without paying its mana cost. If that card would be put into your graveyard this turn, exile it instead.",Artifact Creature,Construct,MHFAPLWBNJPNWSSCWNTRCJMSFPMVTHM, green blue white, green blue, white,midrange,,FALSE
264,1,Hornet Queen,MB,Green,7,{4}{G}{G}{G},2,2,"Flying
Deathtouch (Any amount of damage this deals to a creature is enough to destroy it.)
When Hornet Queen enters the battlefield, create four 1/1 green Insect creature tokens with flying and deathtouch.",Creature,Insect,MHFAPLWBNJPNWSSCWNTRCJMSFPMVTHM, green blue white, green blue, white,midrange,,FALSE
264,1,Myr Battlesphere,MB,Colorless,7,{7},4,7,"When Myr Battlesphere enters the battlefield, create four 1/1 colorless Myr artifact creature tokens.
Whenever Myr Battlesphere attacks, you may tap X untapped Myr you control. If you do, Myr Battlesphere gets +X/+0 until end of turn and deals X damage to the player or planeswalker it's attacking.",Artifact Creature,Myr Construct,MHFAPLWBNJPNWSSCWNTRCJMSFPMVTHM, green blue white, green blue, white,midrange,,FALSE
265,1,Gemstone Mine,MB,Colorless,0,NA,NA,NA,"Gemstone Mine enters the battlefield with three mining counters on it.
{T}, Remove a mining counter from Gemstone Mine: Add one mana of any color. If there are no mining counters on Gemstone Mine, sacrifice it.",Land,NA,GSSIDWSSLKKYGSSSTSAGRF, red green white, red white, green,aggro,,FALSE
265,1,Stirring Wildwood,MB,Colorless,0,NA,NA,NA,"Stirring Wildwood enters the battlefield tapped.
{T}: Add {G} or {W}.
{1}{G}{W}: Until end of turn, Stirring Wildwood becomes a 3/4 green and white Elemental creature with reach. It's still a land.",Land,NA,GSSIDWSSLKKYGSSSTSAGRF, red green white, red white, green,aggro,,FALSE
265,1,Student of Warfare,MB,White,1,{W},1,1,"Level up {W} ({W}: Put a level counter on this. Level up only as a sorcery.)
LEVEL 2-6
3/3
First strike
LEVEL 7+
4/4
Double strike",Creature,Human Knight,GSSIDWSSLKKYGSSSTSAGRF, red green white, red white, green,aggro,,FALSE
265,1,"Isamaru, Hound of Konda",MB,White,1,{W},2,2,NA,Creature,Hound,GSSIDWSSLKKYGSSSTSAGRF, red green white, red white, green,aggro,,FALSE
265,1,Dryad Militant,MB,Colorless,1,{G/W},2,1,"If an instant or sorcery card would be put into a graveyard from anywhere, exile it instead.",Creature,Dryad Soldier,GSSIDWSSLKKYGSSSTSAGRF, red green white, red white, green,aggro,,FALSE
265,1,Wild Nacatl,MB,Green,1,{G},1,1,"Wild Nacatl gets +1/+1 as long as you control a Mountain.
Wild Nacatl gets +1/+1 as long as you control a Plains.",Creature,Cat Warrior,GSSIDWSSLKKYGSSSTSAGRF, red green white, red white, green,aggro,,FALSE
265,1,Stromkirk Noble,MB,Red,1,{R},1,1,"Stromkirk Noble can't be blocked by Humans.
Whenever Stromkirk Noble deals combat damage to a player, put a +1/+1 counter on it.",Creature,Vampire,GSSIDWSSLKKYGSSSTSAGRF, red green white, red white, green,aggro,,FALSE
265,1,Stoneforge Mystic,MB,White,2,{1}{W},1,2,"When Stoneforge Mystic enters the battlefield, you may search your library for an Equipment card, reveal it, put it into your hand, then shuffle your library.
{1}{W}, {T}: You may put an Equipment card from your hand onto the battlefield.",Creature,Kor Artificer,GSSIDWSSLKKYGSSSTSAGRF, red green white, red white, green,aggro,,FALSE
265,1,Lightning Helix,MB,White Red,2,{R}{W},NA,NA,Lightning Helix deals 3 damage to any target and you gain 3 life.,Instant,NA,GSSIDWSSLKKYGSSSTSAGRF, red green white, red white, green,aggro,,FALSE
265,1,Keldon Marauders,MB,Red,2,{1}{R},3,3,"Vanishing 2 (This creature enters the battlefield with two time counters on it. At the beginning of your upkeep, remove a time counter from it. When the last is removed, sacrifice it.)
When Keldon Marauders enters the battlefield or leaves the battlefield, it deals 1 damage to target player or planeswalker.",Creature,Human Warrior,GSSIDWSSLKKYGSSSTSAGRF, red green white, red white, green,aggro,,FALSE
265,1,"Kari Zev, Skyship Raider",MB,Red,2,{1}{R},1,3,"First strike, menace
Whenever Kari Zev, Skyship Raider attacks, create a legendary 2/1 red Monkey creature token named Ragavan that's tapped and attacking. Exile that token at end of combat.",Creature,Human Pirate,GSSIDWSSLKKYGSSSTSAGRF, red green white, red white, green,aggro,,FALSE
265,1,Young Pyromancer,MB,Red,2,{1}{R},2,1,"Whenever you cast an instant or sorcery spell, create a 1/1 red Elemental creature token.",Creature,Human Shaman,GSSIDWSSLKKYGSSSTSAGRF, red green white, red white, green,aggro,,FALSE
265,1,Grafted Wargear,MB,Colorless,3,{3},NA,NA,"Equipped creature gets +3/+2.
Whenever Grafted Wargear becomes unattached from a permanent, sacrifice that permanent.
Equip {0} ({0}: Attach to target creature you control. Equip only as a sorcery.)",Artifact,Equipment,GSSIDWSSLKKYGSSSTSAGRF, red green white, red white, green,aggro,,FALSE
265,1,Sword of Body and Mind,MB,Colorless,3,{3},NA,NA,"Equipped creature gets +2/+2 and has protection from green and from blue.
Whenever equipped creature deals combat damage to a player, you create a 2/2 green Wolf creature token and that player puts the top ten cards of their library into their graveyard.
Equip {2}",Artifact,Equipment,GSSIDWSSLKKYGSSSTSAGRF, red green white, red white, green,aggro,,FALSE
265,1,Sword of War and Peace,MB,Colorless,3,{3},NA,NA,"Equipped creature gets +2/+2 and has protection from red and from white.
Whenever equipped creature deals combat damage to a player, Sword of War and Peace deals damage to that player equal to the number of cards in their hand and you gain 1 life for each card in your hand.
Equip {2}",Artifact,Equipment,GSSIDWSSLKKYGSSSTSAGRF, red green white, red white, green,aggro,,FALSE
265,1,Sword of Light and Shadow,MB,Colorless,3,{3},NA,NA,"Equipped creature gets +2/+2 and has protection from white and from black.
Whenever equipped creature deals combat damage to a player, you gain 3 life and you may return up to one target creature card from your graveyard to your hand.
Equip {2}",Artifact,Equipment,GSSIDWSSLKKYGSSSTSAGRF, red green white, red white, green,aggro,,FALSE
265,1,"Thalia, Heretic Cathar",MB,White,3,{2}{W},3,2,"First strike
Creatures and nonbasic lands your opponents control enter the battlefield tapped.",Creature,Human Soldier,GSSIDWSSLKKYGSSSTSAGRF, red green white, red white, green,aggro,,FALSE
265,1,Sulfuric Vortex,MB,Red,3,{1}{R}{R},NA,NA,"At the beginning of each player's upkeep, Sulfuric Vortex deals 2 damage to that player.
If a player would gain life, that player gains no life instead.",Enchantment,NA,GSSIDWSSLKKYGSSSTSAGRF, red green white, red white, green,aggro,,FALSE
265,1,Arc Lightning,MB,Red,3,{2}{R},NA,NA,"Arc Lightning deals 3 damage divided as you choose among one, two, or three targets.",Sorcery,NA,GSSIDWSSLKKYGSSSTSAGRF, red green white, red white, green,aggro,,FALSE
265,1,Goblin Rabblemaster,MB,Red,3,{2}{R},2,2,"Other Goblin creatures you control attack each combat if able.
At the beginning of combat on your turn, create a 1/1 red Goblin creature token with haste.
Whenever Goblin Rabblemaster attacks, it gets +1/+0 until end of turn for each other attacking Goblin.",Creature,Goblin Warrior,GSSIDWSSLKKYGSSSTSAGRF, red green white, red white, green,aggro,,FALSE
265,1,Restoration Angel,MB,White,4,{3}{W},3,4,"Flash
Flying
When Restoration Angel enters the battlefield, you may exile target non-Angel creature you control, then return that card to the battlefield under your control.",Creature,Angel,GSSIDWSSLKKYGSSSTSAGRF, red green white, red white, green,aggro,,FALSE
265,1,Fiery Confluence,MB,Red,4,{2}{R}{R},NA,NA,"Choose three. You may choose the same mode more than once.
• Fiery Confluence deals 1 damage to each creature.
• Fiery Confluence deals 2 damage to each opponent.
• Destroy target artifact.",Sorcery,NA,GSSIDWSSLKKYGSSSTSAGRF, red green white, red white, green,aggro,,FALSE
266,1,Sacred Foundry,MB,Colorless,0,NA,NA,NA,"({T}: Add {R} or {W}.)
As Sacred Foundry enters the battlefield, you may pay 2 life. If you don't, it enters the battlefield tapped.",Land,Mountain Plains,SMNFIMSAABJLSSTGHMWAHPPE, red white, red white,,aggro,,FALSE
266,1,Marsh Flats,MB,Colorless,0,NA,NA,NA,"{T}, Pay 1 life, Sacrifice Marsh Flats: Search your library for a Plains or Swamp card, put it onto the battlefield, then shuffle your library.",Land,NA,SMNFIMSAABJLSSTGHMWAHPPE, red white, red white,,aggro,,FALSE
266,1,Needle Spires,MB,Colorless,0,NA,NA,NA,"Needle Spires enters the battlefield tapped.
{T}: Add {R} or {W}.
{2}{R}{W}: Needle Spires becomes a 2/1 red and white Elemental creature with double strike until end of turn. It's still a land.",Land,NA,SMNFIMSAABJLSSTGHMWAHPPE, red white, red white,,aggro,,FALSE
266,1,Figure of Destiny,MB,Colorless,1,{R/W},1,1,"{R/W}: Figure of Destiny becomes a Kithkin Spirit with base power and toughness 2/2.
{R/W}{R/W}{R/W}: If Figure of Destiny is a Spirit, it becomes a Kithkin Spirit Warrior with base power and toughness 4/4.
{R/W}{R/W}{R/W}{R/W}{R/W}{R/W}: If Figure of Destiny is a Warrior, it becomes a Kithkin Spirit Warrior Avatar with base power and toughness 8/8, flying, and first strike.",Creature,Kithkin,SMNFIMSAABJLSSTGHMWAHPPE, red white, red white,,aggro,,FALSE
266,1,"Isamaru, Hound of Konda",MB,White,1,{W},2,2,NA,Creature,Hound,SMNFIMSAABJLSSTGHMWAHPPE, red white, red white,,aggro,,FALSE
266,1,Mother of Runes,MB,White,1,{W},1,1,{T}: Target creature you control gains protection from the color of your choice until end of turn.,Creature,Human Cleric,SMNFIMSAABJLSSTGHMWAHPPE, red white, red white,,aggro,,FALSE
266,1,Steppe Lynx,MB,White,1,{W},0,1,"Landfall — Whenever a land enters the battlefield under your control, Steppe Lynx gets +2/+2 until end of turn.",Creature,Cat,SMNFIMSAABJLSSTGHMWAHPPE, red white, red white,,aggro,,FALSE
266,1,Accorder Paladin,MB,White,2,{1}{W},3,1,"Battle cry (Whenever this creature attacks, each other attacking creature gets +1/+0 until end of turn.)",Creature,Human Knight,SMNFIMSAABJLSSTGHMWAHPPE, red white, red white,,aggro,,FALSE
266,1,Arc Trail,MB,Red,2,{1}{R},NA,NA,Arc Trail deals 2 damage to any target and 1 damage to another target.,Sorcery,NA,SMNFIMSAABJLSSTGHMWAHPPE, red white, red white,,aggro,,FALSE
266,1,Boros Signet,MB,Colorless,2,{2},NA,NA,"{1}, {T}: Add {R}{W}.",Artifact,NA,SMNFIMSAABJLSSTGHMWAHPPE, red white, red white,,aggro,,FALSE
266,1,Journey to Nowhere,MB,White,2,{1}{W},NA,NA,"When Journey to Nowhere enters the battlefield, exile target creature.
When Journey to Nowhere leaves the battlefield, return the exiled card to the battlefield under its owner's control.",Enchantment,NA,SMNFIMSAABJLSSTGHMWAHPPE, red white, red white,,aggro,,FALSE
266,1,Lightning Helix,MB,White Red,2,{R}{W},NA,NA,Lightning Helix deals 3 damage to any target and you gain 3 life.,Instant,NA,SMNFIMSAABJLSSTGHMWAHPPE, red white, red white,,aggro,,FALSE
266,1,Selfless Spirit,MB,White,2,{1}{W},2,1,"Flying
Sacrifice Selfless Spirit: Creatures you control gain indestructible until end of turn.",Creature,Spirit Cleric,SMNFIMSAABJLSSTGHMWAHPPE, red white, red white,,aggro,,FALSE
266,1,Stormblood Berserker,MB,Red,2,{1}{R},1,1,"Bloodthirst 2 (If an opponent was dealt damage this turn, this creature enters the battlefield with two +1/+1 counters on it.)
Menace (This creature can't be blocked except by two or more creatures.)",Creature,Human Berserker,SMNFIMSAABJLSSTGHMWAHPPE, red white, red white,,aggro,,FALSE
266,1,"Thalia, Guardian of Thraben",MB,White,2,{1}{W},2,1,"First strike
Noncreature spells cost {1} more to cast.",Creature,Human Soldier,SMNFIMSAABJLSSTGHMWAHPPE, red white, red white,,aggro,,FALSE
266,1,Gideon of the Trials,MB,White,3,{1}{W}{W},NA,NA,"+1: Until your next turn, prevent all damage target permanent would deal.
0: Until end of turn, Gideon of the Trials becomes a 4/4 Human Soldier creature with indestructible that's still a planeswalker. Prevent all damage that would be dealt to him this turn.
0: You get an emblem with ""As long as you control a Gideon planeswalker, you can't lose the game and your opponents can't win the game.""",Planeswalker,Gideon,SMNFIMSAABJLSSTGHMWAHPPE, red white, red white,,aggro,,FALSE
266,1,Hanweir Garrison,MB,Red,3,{2}{R},2,3,"Whenever Hanweir Garrison attacks, create two 1/1 red Human creature tokens that are tapped and attacking.
(Melds with Hanweir Battlements.)",Creature,Human Soldier,SMNFIMSAABJLSSTGHMWAHPPE, red white, red white,,aggro,,FALSE
266,1,Manic Vandal,MB,Red,3,{2}{R},2,2,"When Manic Vandal enters the battlefield, destroy target artifact.",Creature,Human Warrior,SMNFIMSAABJLSSTGHMWAHPPE, red white, red white,,aggro,,FALSE
266,1,Wheel of Fortune,MB,Red,3,{2}{R},NA,NA,"Each player discards their hand, then draws seven cards.",Sorcery,NA,SMNFIMSAABJLSSTGHMWAHPPE, red white, red white,,aggro,,FALSE
266,1,Ajani Vengeant,MB,White Red,4,{2}{R}{W},NA,NA,"+1: Target permanent doesn't untap during its controller's next untap step.
−2: Ajani Vengeant deals 3 damage to any target and you gain 3 life.
−7: Destroy all lands target player controls.",Planeswalker,Ajani,SMNFIMSAABJLSSTGHMWAHPPE, red white, red white,,aggro,,FALSE
266,1,Hero of Bladehold,MB,White,4,{2}{W}{W},3,4,"Battle cry (Whenever this creature attacks, each other attacking creature gets +1/+0 until end of turn.)
Whenever Hero of Bladehold attacks, create two 1/1 white Soldier creature tokens that are tapped and attacking.",Creature,Human Knight,SMNFIMSAABJLSSTGHMWAHPPE, red white, red white,,aggro,,FALSE
266,1,Palace Jailer,MB,White,4,{2}{W}{W},2,2,"When Palace Jailer enters the battlefield, you become the monarch.
When Palace Jailer enters the battlefield, exile target creature an opponent controls until an opponent becomes the monarch. (That creature returns under its owner's control.)",Creature,Human Soldier,SMNFIMSAABJLSSTGHMWAHPPE, red white, red white,,aggro,,FALSE
266,1,"Purphoros, God of the Forge",MB,Red,4,{3}{R},6,5,"Indestructible
As long as your devotion to red is less than five, Purphoros isn't a creature.
Whenever another creature enters the battlefield under your control, Purphoros deals 2 damage to each opponent.
{2}{R}: Creatures you control get +1/+0 until end of turn.",Enchantment Creature,God,SMNFIMSAABJLSSTGHMWAHPPE, red white, red white,,aggro,,FALSE
266,1,"Elspeth, Sun's Champion",MB,White,6,{4}{W}{W},NA,NA,"+1: Create three 1/1 white Soldier creature tokens.
−3: Destroy all creatures with power 4 or greater.
−7: You get an emblem with ""Creatures you control get +2/+2 and have flying.""",Planeswalker,Elspeth,SMNFIMSAABJLSSTGHMWAHPPE, red white, red white,,aggro,,FALSE
267,1,Library of Alexandria,MB,Colorless,0,NA,NA,NA,"{T}: Add {C}.
{T}: Draw a card. Activate this ability only if you have exactly seven cards in hand.",Land,NA,LIZRRLMESDBRBMISARSENFKZBS, red white, red white,,aggro,,TRUE
267,1,Inspiring Vantage,MB,Colorless,0,NA,NA,NA,"Inspiring Vantage enters the battlefield tapped unless you control two or fewer other lands.
{T}: Add {R} or {W}.",Land,NA,LIZRRLMESDBRBMISARSENFKZBS, red white, red white,,aggro,,TRUE
267,1,Zurgo Bellstriker,MB,Red,1,{R},2,2,"Zurgo Bellstriker can't block creatures with power 2 or greater.
Dash {1}{R} (You may cast this spell for its dash cost. If you do, it gains haste, and it's returned from the battlefield to its owner's hand at the beginning of the next end step.)",Creature,Orc Warrior,LIZRRLMESDBRBMISARSENFKZBS, red white, red white,,aggro,,TRUE
267,1,Rift Bolt,MB,Red,3,{2}{R},NA,NA,"Rift Bolt deals 3 damage to any target.
Suspend 1—{R} (Rather than cast this card from your hand, you may pay {R} and exile it with a time counter on it. At the beginning of your upkeep, remove a time counter. When the last is removed, cast it without paying its mana cost.)",Sorcery,NA,LIZRRLMESDBRBMISARSENFKZBS, red white, red white,,aggro,,TRUE
